,art_id,art_content,art_comment,art_date_grabbed
62,138,"The Co-op is to be the first major supermarket in the UK to replace single-use plastic carrier bags with lightweight compostable alternatives that shoppers can reuse as biodegradable bags for food waste.  The bags – a stronger version of the biodegradable bags the convenience chain has been trialling since 2014 – will be rolled out within weeks to almost 1,400 stores across England, Scotland and Wales, and then to all 2,600 shops.  The change will start in towns, cities and villages where the bags are accepted in councils’ food waste collections, and the phased rollout will replace an estimated 60m plastic single-use carrier bags of the sort that have become an environmental scourge. The new-style bags will cost 5p, but shoppers also have the choice of plastic 10p “bags for life” and £1 heavy-duty turquoise Co-op carriers.  The move is part of a broader ethical strategy to be launched by the Co-op next week, tackling plastic pollution as well as covering food waste, healthy eating, saving energy and Fairtrade products. The Co-op says it will ban single-use own-brand plastic products and reduce its overall use of plastic packaging within five years, and stop using hard-to-recycle materials such as black plastic.  “The price of food wrapped in plastic has become too much to swallow and, from today, the Co-op will phase out any packaging which cannot be reused,” said Jo Whitfield, retail chief executive of the Co-op. “The first step to remove single-use plastic will be to launch compostable carrier bags in our stores. They are a simple but ingenious way to provide an environmentally friendly alternative to plastic shopping bags.”  The supermarket’s pledge on plastic will see all its own-brand packaging become easy to recycle by 2023. It has promised to use a minimum of 50% recycled plastic in bottles, pots, trays and punnets by 2021.  However on Friday Lidl UK stole a march and said it would remove black plastic from its entire fruit and vegetable range by the end of the month, becoming the first UK supermarket to do so. It also plans to remove black plastic from its fresh meat, fish and poultry range by August next year.  Meanwhile, Asda revealed that it is “nearly halfway” towards meeting its 10% plastic reduction target, which it first unveiled in February this year.  Last week, Waitrose announced it was to remove plastic bags for loose fruit and vegetables and 5p single-use plastic bags from its stores by next spring.  In a first response to a growing public backlash against the huge volumes of plastic rubbish, most of the UK’s largest supermarkets signed up in April to the UK Plastics Pact , an industry-wide initiative that aims to transform packaging and reduce avoidable plastic waste.",3,2018-09-23 23:38:45
63,139,"A woman at the centre of a bizarre fresh nerve agent scare in Salisbury has denied that it was an elaborate hoax.  Russian-born model Anna Shapiro claimed on Friday that she really did fear her husband, Alex King, had been poisoned at an Italian restaurant in Salisbury.  She also appeared to stick by the story – which she told the Sun newspaper in vivid detail – that she was targeted by Russians.  Wiltshire police have been investigating the curious incident that resulted in streets being cordoned off and experts in protective suits tending to Shapiro, King and other people who were in the Prezzo restaurant on Sunday evening.  Medics were quickly able to rule out that there had been another nerve agent attack six months after the former Russian spy Sergei Skripal and his daughter, Yulia, collapsed in the city.  There then followed speculation that the incident may have been a hoax and Wiltshire police have interviewed Shapiro, 30, and King, 42 .  On Friday evening, Shapiro’s lawyer, James Mullion, of Janes Solicitors, said: “There has been some media speculation that our client may have participated in an elaborate hoax as regards her fear of her husband’s poisoning at Prezzo restaurant on Sunday and its possible cause.  “She has asked Janes Solicitors to emphasise that she was not involved in any hoax and that her fears were genuine both as to the poisoning and her suspicion of foul play.  “However, as the incident is now being investigated by Wiltshire police, it is not appropriate to comment further at this stage. We ask the media respect our client’s privacy whilst she recovers from her ordeal.”  The incident was a further blow to Salisbury, which has been struggling to recover from the attack on the Skripals and the subsequent nerve agent poisonings of a local couple, Charlie Rowley and Dawn Sturgess.  In a front-page story published in the Sun newspaper on Wednesday, Shapiro claimed she and her husband had been targeted by Moscow.  The Sun reported that King was in a life-threatening condition and suggested he may have been poisoned with strychnine. By Wednesday evening, however, the story began to unravel when Salisbury district hospital released a statement saying both patients involved in the incident had been discharged and police sources said officers were looking into the possibility that the incident was a hoax.  The Sun’s original story about Shapiro’s claims was unavailable on its website by Thursday morning. A message said this was “for legal reasons”. The newspaper has refused to say whether it paid Shapiro for the story.  Shapiro and King are friends of Edward Davenport, nicknamed “Fast Eddy”, who is famed for throwing parties at a central London mansion attended by rock stars and film actors – and for being jailed for fraud . King used to act as Davenport’s “press representative” .  Davenport described King as a “fun guy” and told how in 2006 King won a £100,000 bet to get into a royal premiere and shake hands with Prince Charles. The Telegraph described King then as a “prankster” .  Meanwhile, Prezzo has re-opened. A spokesperson said on Friday: “We are delighted to have our Salisbury restaurant returned to us and to be back serving the Salisbury community and visitors.  “Our team have been both brave and resilient and we are extremely proud of how they handled the very difficult and completely unexpected situation in which they found themselves.  “We would also like to thank the emergency services who attended on the evening in question and our wonderful neighbours in Salisbury, who literally opened their doors to customers and staff caught up in the events of Sunday night.  “As you will understand we will not speculate any further on the individuals involved. This is now a matter between them and the police.”  A Wiltshire police spokesperson said: “We can confirm that both people have been interviewed and our inquiries are ongoing. We would ask the media not to speculate whilst these inquiries are ongoing.” No arrests have been made.",3,2018-09-23 23:38:50
64,140,"A man has died and a teenager left wounded after being stabbed in north-east London.  The Metropolitan police said they were called to a fight at a flat in Stamford Hill at 12.50am on Saturday.  Officers found a 20-year-old man and a 17-year-old boywith knife wounds. Both were taken to hospital where the man was pronounced dead at 4.30am. The boy’s condition was not believed to be serious, the Met said.  No arrests had been made and detectives from the homicide and major crime command were investigating.",3,2018-09-23 23:38:54
65,141,Deputy attorney general Rod Rosenstein deemed “inaccurate” a report that he spoke with colleagues last year about the possibility of removing Donald Trump from office under the 25th amendment and about making secret recordings of the president.,3,2018-09-23 23:39:06
66,142,"The Vatican and China said yesterday they had signed a historic agreement on the appointment of Roman Catholic bishops, a breakthrough on an issue that for decades fuelled tensions between the Holy See and Beijing and thwarted efforts toward diplomatic relations.  The provisional agreement, which was signed in Beijing by deputy foreign ministers from both sides, was described by the Vatican as “the fruit of a gradual and reciprocal rapprochement”, following a long process of careful negotiation, and subject to periodic review.  “It concerns the nomination of bishops, a question of great importance for the life of the church, and creates the conditions for greater collaboration,” the Vatican said.  In Beijing, the foreign ministry put out a statement saying: “China and the Vatican will continue to maintain communications and push forward the process of improving relations between the two sides.”  But the deal was denounced by critics as a sellout to the communist government. “They’re [sending] the flock into the mouths of the wolves. It’s an incredible betrayal,” Cardinal Joseph Zen, the former archbishop of Hong Kong who has led the opposition to the deal , told Reuters.",3,2018-09-23 23:39:12
67,143,"Grieving families were on Sunday preparing to bury victims of Tanzania’s devastating ferry disaster, with more than 200 confirmed dead after the crowded boat capsized in Lake Victoria.  Hopes were fading of finding any more survivors three days after the ferry sank, even after rescuers pulled out an engineer who had managed to find refuge in an air pocket in the upturned vessel. The Tanzanian broadcasting corporation reported he had shut himself in the engine room.  “We are going to start burying bodies not yet identified by relatives,” said John Mongella, governor of Mwanza region, where the MV Nyerere ferry had been coming in to dock on the island of Ukara.  “The (burial) ceremony will be overseen by Prime Minister Kassim Majaliwa, in the presence of clergy members of different denominations,” Mongella Told TBC 1 public television.  Mongella said 218 people had been confirmed dead, while 41 escaped the tragedy with their lives – a total figure far above the official capacity of the boat, which was in theory only able to carry 101 passengers.  Transport Minister Isack Kamwelwe said on Saturday that 172 of the victim’s bodies had been identified by relatives.  Navy divers resumed the search operation inside the sunken MV Nyerere early on Saturday after hearing sounds that suggested signs of life. They pulled a man out of the overturned ship and he was taken to hospital, a witness said, while bodies continued to float to the surface around the vessel. Tanzania’s president, John Magufuli, has ordered the arrest of the managers of the ferry, which may have been carrying as many as 300 people when it capsized near the dock on the Ukara Island. The precise number was unknown, however, because the ticket-seller had drowned and the machine recording sales had not been found. During a speech on public television on Friday night, Magufuli referred to negligence and said he had ordered the arrest of all those involved in the management of the ferry. “It appears clear that the ferry was overloaded,” he said, adding that the arrests had already begun. The president also declared four days of national mourning. The works, transport and communication minister, Isack Kamwelwe, said the government was sending sophisticated equipment to aid the rescue. “This equipment will increase efficiency in the rescue operation and we will continue with the search until we are satisfied that we have rescued everyone,” he told Reuters. At least 40 people were brought to safety on Thursday as dozens of security forces and volunteers wearing gloves and face masks spent the day hauling bodies into wooden boats. Tanzanian ferries often carry hundreds of passengers and are overcrowded, and there are shifts in weight as passengers move to disembark. The Nyerere was crowded because it was a market day.  Domina Maua, who was among those at the dockside seeking information about survivors on Friday, said she had not heard from either her father or her younger brother who were on the ferry on a trip to buy a school uniform and other supplies for the new school term. The son of Davita Ngenda, an older woman in Ukara, was among the dead. “He had gone with his wife but she has not been found yet. My God, what did I do to deserve this?” she said. The ageing ferry, of which the hull and propellers were all that remained visible, was also carrying cargo, including sacks of maize, bananas and cement, when it capsized about 50 metres from Ukara dock. The cause of the accident was not immediately clear, but overloading is frequently to blame for such incidents. The country’s opposition, however, accused the government of negligence. “We have often raised concerns about the poor condition of this ferry, but the government turned a deaf ear. We have repeatedly denounced this negligence,” said John Mnyika, the deputy secretary general of Chadema, the main opposition party. Mnyika said overloading was “another failure of the authorities” and criticised “inadequate relief efforts as well as delays” in the rescue operation. With a surface area of 70,000 sq km (27,000 sq miles), the oval-shaped Lake Victoria is shared by Tanzania, Uganda and Kenya. Capsizes are not uncommon and the number of deaths is often high because of a shortage of lifejackets and the fact that many people in the region cannot swim.  The deadliest such incident in recent decades was in May 1996, when about 800 people died after their ferry sank on the way to Mwanza in Tanzania. Lake Victoria’s waters can be rough and boats are frequently poorly maintained, while ferry operators often fail to record the number of passengers on board.  About 20 people were killed in December 2016 when a boat overturned on the lake as it was carrying passengers to mainland Uganda for the Christmas holidays.  In March 2012, only two survivors were found after a boat carrying about 60 people capsized on the lake in Uganda.",3,2018-09-23 23:39:21
68,144,"At least eight children have been killed in a roadside bomb explosion in northern Faryab province, an Afghan official has said.  Karim Yuresh, spokesman for the provincial police chief, said six other children were wounded in the blast that took place late Friday afternoon in Shirin Tagab district.  Yuresh said that according to a hospital report, two of the wounded children were in critical condition. He said all of the children were between five and 12 years of age and were playing when the bomb exploded.  No one immediately claimed responsibility for the attack, but Yuresh blamed Taliban insurgents who usually planted roadside bombs to target Afghan security forces in different part of the province.",3,2018-09-23 23:39:32
69,145,"E urope’s largest port, Rotterdam, is counting down to Brexit. “In about 200 days’ time, if nothing else happens… we will need to supervise all the goods coming in and out of the UK market,” says Roel van ’t Veld, Brexit coordinator at the Dutch customs authority.  Hard Brexit or soft? Chequers dead or alive ? Does “max-fac” make any sense? The feverish debate in Westminster is distant for officials in Rotterdam, who are working on the assumption the UK will leave the EU’s single market and customs union on 29 March 2019.  At the stroke of midnight, the UK will become another country to its EU neighbours. Rotterdam will have to run checks on 10,500 newly “foreign” boats. Officials expect a 30% increase in import inspections and a 100% increase in export inspections. Ferry operators warn of form-filling and delays. While a transition period could delay those changes until 2021, nothing is being taken for granted.  Companies are “spoiled” by the ease of trading within the EU’s internal market, van ’t Veld says. Take a Dutch company that makes ready meals for British consumers. Today it needs only a contract with a shop. In future, companies on both sides of the North Sea would need production location registration, an export declaration, exit and entry declarations and more.  “Instead of two pieces of documentation you would need nine additional documents,” says van ’t Veld, based on his reading of the UK customs bill. “In 200 days’ time, you cannot just send a ship , and if you don’t anticipate those changes, ships will not get through the gates.” (Since he spoke this month, more days have slipped by.)  The Netherlands will be one of the EU countries hardest hit by Brexit. Even under the “best-case” scenario of an EU free-trade agreement with the UK, it would lose 0.9% of annual economic output, worth €450 (£400) per person by 2030, according to the Netherlands Bureau for Economic Policy Analysis.  And when Brexit hurts, Rotterdam will feel the first pinch. Spread over a 25-mile-long area, the city supports 180,000 jobs and 3.5% of Dutch economic output. To prepare for Brexit, 928 extra customs officials and 145 veterinary inspectors are being hired, following a recommendation from the Dutch parliament.  Pieter Omtzigt, a Christian Democrat MP, who co-drafted the parliament’s report on Brexit, describes his message to the government: “Be prepared. Because Great Britain is running so late that you may run into trouble because there hasn’t been time to prepare things. This is a way too serious scenario.”  He would prefer Dutch public money were spent on 1,000 new teachers or nurses, he tells the Observer , but feels his country has no choice. “If, like the Netherlands, you earn more than half your money with trade, you understand that if the UK leaves the customs union, the work for customs and excise increases significantly. The Netherlands simply cannot afford a disrupted customs system.”",3,2018-09-23 23:39:35
70,146,"Political attack ads can be vicious – but the jabs don’t normally come from the candidate’s own family. That, though, is what has happened to the Arizona Republican Paul Gosar. And then some.",3,2018-09-23 23:39:37
71,147,"Judges in Palermo have ordered the immediate release of six Tunisian fishermen who were arrested by the Italian police on suspicion of enabling the smuggling of migrants.  The men were captured at sea early in September after their trawler released a small vessel it had been towing with 14 migrants onboard, 24 miles (37km) from the coast of the Italian island of Lampedusa.  Since their arrest, friends and colleagues have rallied to their defence, saying they have saved hundreds of migrants and refugees who risked drowning in the Mediterranean over the years. Prosecutors have accused the men of illegally escorting the boat into Italian waters and claimed they had no evidence of an SOS sent from either the migrants’ boat or the fishermen’s vessel.  According to their lawyers, the Tunisians maintain that they saw the vessel in distress and a common decision was made to tow it to safety in Italian waters.",3,2018-09-23 23:39:44
72,148,It underlines America’s strange and turbulent political moment that the highest-profile and most intriguing battle in November’s midterm elections is in one of the most predictably Republican states.,3,2018-09-23 23:39:47
73,149,,3,2018-09-23 23:39:50
