,art_id,art_content,art_comment,art_date_grabbed
124,1034,"I t was while house-hunting in the Provençal village of Vallabrègues that Benoît Rauzy and Anthony Watson first stumbled upon a perfectly preserved 18th-century hôtel particulier . “It was like a bridge to the past,” says Rauzy of the property, close to Avignon, that they’ve since restored and now call home. “You opened the door and fell into another time.” Though built in 1730, the house had previously been in the ownership of just two families. More exceptional still, among the original murals, fireplaces and paintings were clues to the village’s past – half-made baskets, rattan chairs and furniture sketches – all vestiges of its previous incarnation as a wicker workshop.",3,2018-09-23 23:44:31
125,1035,"E arly one Sunday morning a month ago, a German carpenter was fatally stabbed in a street fight in Chemnitz in eastern Germany. Little is known about how the brawl started, but rumours rapidly circulated online that the man was defending a woman from sexual assault. Within hours of his death, rumours that his killers were two refugees triggered a violent reaction. For two nights running, thousands of rightwing extremists and sympathisers took to the streets of the city . Shocking videos of demonstrators openly using the Nazi salute (a criminal offence in Germany) and chasing and attacking people of foreign appearance rapidly appeared online.  The reverberations of the riots continue to roil German politics and society. They appear to have given a massive boost to the right-wing AfD party, for example, which according to some opinion polls is now in second place in Germany. And last week, Angela Merkel removed the head of the domestic intelligence agency, Hans-Georg Maaßen , from his post after he faced criticism for his reaction to anti-immigrant protests in the city of Chemnitz. He had cast doubt on the authenticity of the videos showing dark-skinned people being chased and attacked.  What’s going on? How did many Germans become so worked up about a street brawl? This question intrigued Ray Serrato , a Berlin-based digital researcher who first noticed it when his wife’s uncle showed him a YouTube video that claimed the rioters had been Muslim refugees. The video was cheaply produced and uploaded by an obscure fringe group and yet it had had nearly half-a-million views – far more than any legitimate news video of the riots. How was this possible?",9,2018-09-23 23:44:38
126,1036,"I s this year’s Labour conference in Liverpool going to rise to the occasion and put the party firmly on the road to stopping Brexit?  With mounting support among trade unionists for a “people’s vote”, it would be a welcome outcome if what my old friend and Observer colleague Alan Watkins called “the people’s party” finally got its act together in the interests of the country and all working people.  It was Liverpool in the early 1980s that witnessed the nadir of Labour’s near-capture by the extreme-left Militant Tendency. The shameful absurdity of it all was captured in a magnificent conference speech by Neil Kinnock, in which he had scathing words for a council under the control of one Derek Hatton that had sent redundancy notices to council workers by taxi.  Redundancy notices? Yes, the council’s funds were being so mismanaged that “economies” were deemed necessary. That notice of these economies was being sent to the victims by taxi was surreal.  Last time I visited Liverpool, for the Labour conference two years ago, I was hailed by several proud denizens who, spying strangers, asked me to spread the news about the impressive developments in the city since the early 80s.  A good start on the road to Liverpool’s recovery was made, with that great, go-getting Conservative minister Michael Heseltine inspiring various physical infrastructure projects, and (full disclosure) my late father-in-law, Maurice Stonefrost – probably the country’s leading expert in local authority finance at the time – producing the Stonefrost report, to rescue the city’s financial infrastructure.",9,2018-09-23 23:44:41
127,1037,"U ntil about five years ago, Ralph Taylor did not consider himself black. He lived as a white man and was seen as such by friends, colleagues and clients. In 2010, he took a genetic test that estimated his ancestry to be 90% European, 6% indigenous American and 4% sub-Saharan African. Four years later, he applied for his insurance business to be certified as a “disadvantaged business enterprise” to make it easier to win government contracts. He was turned down. Officials could find “no persuasive evidence that Mr Taylor has personally suffered social and economic disadvantage by virtue of being a Black American”. Now Taylor is suing the US government because he considers himself to be “black based upon DNA evidence”.  Taylor is, by any rational definition, white and the attempt to have himself officially declared black seems little more than a money-spinning exercise. Yet, absurd though his claims are, his case speaks also to our times. Navigating racial categories has today become increasingly fraught and many of the ways in which we commonly think of racial and cultural identities are as hollow as Taylor’s claim to be black.  “I wanted to know who I am,” claims “Kim” in a television advert for the testing company Ancestry.com. “The most shocking result,” she tells us, “is that I’m 26% Native American”. “This is what I’m made of,” she explains. “I absolutely want to know more about my Native American heritage.”  Genetic testing has become a billion-dollar industry – more than 12 million people have taken such tests to discover “ who I am ”. The dubious character of the results has been well rehearsed. It means no more to say that Kim is Native American than to say Taylor is black. Yet the idea that DNA tells us something fundamental about our social identity and sense of belonging has become embedded. The American geneticist Rick Kittles, founder of the genetic testing company African Ancestry, traced his maternal line to the Hausa tribe in Nigeria. Learning about Hausa culture and traditions, Kittles wrote, “gave me sense about who I am”.  His comments reflect the way that notions of race, culture and identity are increasingly becoming conflated. From local authority adoption policies to the debate over “ Cheddar Man ”, there is a desire to link genetic inheritance to social heritage to contemporary identity.  In the past, it was racists who obsessed about racial categories, devising systems by which to divide populations. Anti-racists challenged both the process of racial categorisation and the use of such categories to enforce discrimination.  Today, the struggle against racism is defined as much by a desire for identity and recognition as by a demand for equality. The very meaning of equality has changed. Where once it meant the right to be treated equally despite differences of race or ethnicity or culture, now equality means the right to be treated differently because of them.  “Stay in your lane” has become a favoured demand of anti-racists; meaning “do not interfere with what rightfully is in the domain of other racial or cultural groups”. One fashionable expression of this is the furore over cultural appropriation – the insistence that people should not, without “permission”, borrow from a culture that is not theirs. Sometimes, the issue is trivial, as in the condemnation of Jamie Oliver’s “jerk chicken” . At other times, it can be of profound importance, as in the campaign against Dana Schutz’s Open Casket , a painting of Emmett Till , an African American teenager murdered by a Mississippi lynch mob in 1955. Many objected to a white painter depicting such a traumatic moment in black history. Implicit in the campaign, the critic Adam Shatz observed, was a “disavowal that acts of radical sympathy, and imaginative identification, are possible across racial lines”.  “Know your place” used to be the cry of those who demanded that social hierarchies be maintained. Now it’s the slogan of those for whom the struggle against racism is more about policing boundaries than pursuing equality.  Some may suggest that to exclude worthless claims such as Ralph Taylor’s requires identities to be defined in more rigid ways. That is to misunderstand the problem. Whether Taylor has 4% or 40% African heritage is immaterial. What matters is the way that society treats individuals deemed to be of one race or another. What makes blackness into an issue in America is job discrimination, voter disqualification, police brutality, mass incarceration.  Racial differences are important because racism is a reality. But challenging racism requires us to confront, not embrace, claims about racial categories that are the province of racists.  • Kenan Malik is an Observer columnist",4,2018-09-23 23:44:44
128,1038,"S omething has been niggling me about Tesco’s new discount supermarket chain, Jack’s . Obviously, Tesco is entitled to take on the likes of Aldi and Lidl and, in this era of food banks, it’s difficult to argue against cheap produce. If the reports from the first Jack’s store, in Chatteris, Cambridgeshire (“80% British”; “Cheap alcohol”; “ Like shopping 30 years ago ”) make the general ambience sound a bit like a low-cost grocery emporium that you might find in a third-wave-austerity theme park, then that’s just a sign of the times.  What I’m concerned about is what Jack’s ( named after Tesco’s founder, Jacob “Jack” Cohen ) might be saying about an evolution in retail segregation. While different supermarket chains are obviously aimed at different people, on varying incomes, there’s something about Jack’s that whiffs a little too strongly of poorer customers being rather unsubtly “zoned”, and in a way that steers them well clear of the core Tesco brand. Basically, I’m concerned about why Jack’s is called Jack’s.  Obviously, this type of zoning goes on throughout retail. At the opposite extreme to Jack’s, Gwyneth Paltrow’s Goop opens a pop-up store in London (from this week until January). With its famously high-end ludicrous musings , products and prices (vaginal steam-cleaning, Brain Dust supplements, a mere £11,500 for a gold-plated sex toy), Goop’s $250m-niche boutique concept (basically Space NK for rich, gullible simpletons) is clearly not catering for the austerity pound. Brands such as Goop are probably wary of being contaminated by the mega-discount market. However, so seemingly is Tesco.",9,2018-09-23 23:44:50
129,1039, ,9,2018-09-23 23:44:53
130,1040,"T he Labour party is proposing to ban parents from discovering the sex of an unborn child early in pregnancy for fear that it could lead to selective abortion.  Non-invasive screenings are now being offered at nine to 10 weeks into a pregnancy, to allow parents to discover whether a foetus has Down’s syndrome or other genetic conditions. Naz Shah , shadow women and equalities minister, told the Victoria Derbyshire show that the test could be used, particularly within Asian communities, to selectively abort girls.  A 2014 Department of Health report found no evidence of sex selection taking place in England and Wales. A later report observed: “Analysis of gender birth ratios by ethnicity of the child… found no ratio to be significantly higher than [that expected naturally].”  The issue, however, is not simply one of numbers. It is that of the state controlling what a woman is permitted to know about her pregnancy. In any other circumstance, feminists would condemn the idea that women cannot to be trusted to make decisions about their reproductive futures. It’s an attitude both patronising and misogynistic.  The NHS offers pregnant women ultrasound scans that can reveal the sex of a foetus. Abortion is legal until 24 weeks. Is Shah suggesting that parents should not be able to see their scans? The logic can be extended beyond the issue of selective abortion. Perhaps the government should stop providing information about immigration numbers for fear it might inflame anti-immigrant sentiment? Or stop telling pupils their GCSE results in case it depresses some?  Sex-selective abortions are an issue in some parts of the world, particularly India and China. The answer is to tackle attitudes, not to deny women knowledge about their own bodies.",3,2018-09-23 23:44:56
131,1041,"A wretched characteristic of UK light entertainment has been its obsession with sending our own grands hommes and dames of the television establishment overseas to make programmes. This serves two purposes: it provides some respite from veteran cravat-wearers whingeing about ageism on television and helps executives use up all the expensive spare time on those eye-watering contracts. This gives us the opportunity to see vaguely familiar thespian types mincing about in foreign kitchens or being condescending about the curious customs of the locals.  A joyous byproduct of this is watching the amusement in the faces of a benevolent foreign host as Jasper or Jemima tries to remain insouciant when confronted with les ballons de cochon in a wee sauce soubise. Other shows are frayed versions of the ones Alan Whicker used to do. Occasionally, you get a show such as the one Michael Palin is doing on Channel 5 about life inside North Korea . Half a battalion of Pyongyang’s finest are looking over his shoulder and his passport resides in the desk of a local state excellency. So we can be sure we’ll discover about as much about life beyond the 38th parallel as an open-top bus tour around Possilpark.",9,2018-09-23 23:44:58
132,1042,"Bodyguard  9pm, BBC One  Jed Mercurio’s outstanding political thriller thunders to a terrifying close with a 75-minute finale guaranteed to stretch your armchair detective powers to the limit – and leave you exhausted, satisfied and ever-so-slightly bereft, as your weekly appointment with the high-octane world of PS David Budd vanishes from the calendar. It’s been a rollercoaster ride throughout and this episode pulls no punches, ratcheting up the tension by degrees until it reaches a shattering denouement. One of the TV events of the year. Mike Bradley  The Leeds International Piano Competition 2018  7pm, BBC Four  The competition to find the world’s best young pianist comes to a close with final performances to decide between Croatia’s Aljoša Jurinić, Russian Anna Geniushene, Mario Häring from Germany, Eric Lu from the USA and Xinyuan Wang from China. Mike Bradley  Battle of Britain: Model Squadron 8pm, Channel 4  Chocks away one last time as the modellers recreate aerial events from 15 September 1940, the climax of the Battle of Britain. A series that has neatly mingled history with a sympathetic study of the featured enthusiasts who couldn’t give a flying one if others find their hobby nerdy. Jonathan Wright  Vanity Fair 9pm, ITV  The Georgian soap forges ahead with the Battle of Waterloo. Behind the lines, Becky Sharp sees the chance to exploit the war for financial gain as the assembled nobs take fright at Napoleon’s advance. Horses are at a premium for those desperate to escape and our (anti-)heroine just happens to have two secret steeds for sale. Mike Bradley  Celebrity Island With Bear Grylls  9pm, Channel 4  This year’s contest has seen celebrities abandon the island at such a pace that next week’s episode may well just consist of Bear swilling a mug of urine. Until then, though, Montana Brown and Anthony Ogogo head out hunting, and the camp-mates cool then warm towards Eric Roberts. Hannah J Davies  No Activity  10.30pm, BBC Two  Another beautifully observed double bill following Australian cops and crooks waiting, essentially, for Godot (or should that be G’day?). First, Hendy is joined by a prickly American, while Jimmy explains how he orders takeaways in the associated accent (“I think it’s appreciated that you’ve made a special effort”). Ali Catterall  Film choice  No, 1.35am, Film4",3,2018-09-23 23:45:05
133,1043,"W e are all familiar with the gut-wrenching, disturbing images of the German Student Union burning books under the Nazi regime. It’s less well known, perhaps, that the photograph we often associate with this time shows the burning of the libraries of Dr Magnus Hirschfeld, the first man – that we know of – to use the term transsexual and perform gender confirmation surgery on Lili Elbe (as seen in the film The Danish Girl ).  Rarely would we see book burnings today, but routinely books are challenged or banned on grounds of impropriety. Let’s start with a personal example. My guide to gender, sexual identity and LGBTQ sex education, This Book Is Gay (2014), was challenged in Wasilla, Alaska, when a parent discovered the title in the children’s non-fiction section of her local library. I concur that it is not a children’s book; it’s for young adults. I agree it should be shelved appropriately in libraries. However, before long, locals demanded that the book be removed entirely. I’m pleased to say the title remains in the YA section of Wasilla public library.  Today books are most commonly challenged where religion and state are closely tied, but the UK has form when it comes to banning books. DH Lawrence’s Lady Chatterley’s Lover (1928) famously had to go through the courts to be published in its entirety in 1960. “Is it a book that you would even wish your wife or your servants to read?” the prosecution asked. The book was printed uncensored for the first time in the UKand led to a literary sexual awakening not seen again until Fifty Shades of Grey mania half a century later.",9,2018-09-23 23:45:07
134,1044,"L ike summer heat, it was here and now it’s gone. The colourful, inexplicable Christo installation floating on London’s Serpentine will begin to be dismantled today; all done, suddenly, with its strange business of delighting and baffling visitors to Hyde Park.  Last week, the 7,506 oil barrels of Mastaba , the artist’s 20-metre high pink, blue and red fortress, were still glinting in the evening sun when I took a trip on the Solar Boat that crosses the lake during the summer months. As we took photographs, on one side of me I could overhear praise for the artwork’s playful grandeur. On the other side, someone was grumbling about how dull and pointless it seemed.  Mastaba ’s creator, the veteran installation artist who for years worked alongside his late wife, Jeanne-Claude, has always prompted these contradictory responses. Christo has wrapped up Berlin’s Reichstag , the Pont Neuf in Paris and even a network of Australian coastal cliffs in white cloth, making some people gape and others roll their eyes. And he has a long history with oil barrels, creating his first work from them with Jeanne-Claude in 1961.",9,2018-09-23 23:45:10
135,1045,"Serial: Season 3 | serialpodcast.org Intrigue: The Ratline (Radio 4) | iPlayer  Serial 3 is here and it’s a very different proposition to Serials 1 and 2 . Serial 1 , about the 1999 murder of Hae Min Lee and the subsequent conviction of Adnan Syed, was small, detailed and obsessive. It focused on one incident, fixated on tiny details. Serial 2 , which examined the case of Bowe Bergdahl, a US soldier captured by the Taliban in 2009, was also about one man, though the landscape, which moved from Afghanistan to Pakistan to Guantánamo Bay to the White House, was vast and consequential. Serial  3 changes the scale again. It’s centred on one place, but it will tell multiple tales. For Serial fans, it’s like moving from a pop song to a symphony; from West Cork to The Wire .  We are at the Justice Center in Cleveland, Ohio. This is the high-rise building that contains the city’s justice department, from jail (in the basement) to courthouses (the higher the floor, the more serious the crime). Sarah Koenig, our producer/presenter, talks us through: “The elevator really runs the place,” she says and explains why. Koenig’s opening six-and-a-half-minute description of the building is quite astonishing, like a chapter from Dickens or Maupassant. I had to keep stopping to go back, to play small parts over again, just for my own enjoyment. Such beautiful language! It makes you remember that Serial is not only about the individuals it chooses to focus on – it’s about the production: the reporting, the writing, the asides. The consistent empathy, the moral niggles, the revealing vignettes. How the story is told. Serial  3 makes you understand that what you really enjoy about Serial is Koenig and her team.  This series – “one courthouse told week by week” – promises to take us through various individual cases, and through these to an understanding of the US justice system. (This is only possible due to the access allowed to Koenig and the Serial team; they spent a year in Cleveland and seem to have recorded almost everywhere.)  And the first case seems quite straightforward, almost comically unfair, an easy decision. They chose to start with it, says Koenig, because it was “an example of the system actually working”. Except you’re left with the uneasy feeling that it didn’t… We’re told that 96% of convictions are decided on a plea bargain. So if you don’t seem completely innocent, you’ll probably end up guilty, even if only a little bit.  Innocent or guilty. All of the Serial series make listeners consider whether anyone can be completely one or the other. And, more troublingly, all Serial series also make us consider the systems around innocence and guilt. How fallible these systems are, how often they seem to get it wrong, even when we’re told they get it right.",9,2018-09-23 23:45:13
