,art_id,art_content,art_comment,art_date_grabbed
171,1096,"W hen Theresa May woke up on Friday morning to headlines speaking of her humiliation in Salzburg , it was not an entirely novel experience for a prime minister who has become synonymous with calamity. She has had many Catastrophic Fridays. And Miserable Mondays, Terrible Tuesdays, Wicked Wednesdays, Torrid Thursdays, Savage Saturdays and Searing Sundays.  One of the notable features of her premiership has been the extraordinary capacity of the human sponge at Number 10 to soak up pitiless batterings that would have crushed other politicians. One of Mrs May’s female colleagues in the cabinet recently offered me the opinion that any man in her tortured position would have long since thrown in the blood-soaked towel.  Even so, the Salzburg debacle was exceptionally ignominious for Mrs May, both politically and personally. She did not fly to Austria with the expectation that the EU leaders were going to fully embrace her Chequers proposal for the future relationship. She was not that delusional. The prime minister did think the EU would talk in language that was sufficiently friendly for her to be able to argue that Chequers was still viable and that might help her endure a difficult Tory party conference. The Chequers plan, already pretty friendless in parliament and unpopular with British voters, needed some warm words from the EU if it was to have a hope of staying airborne. Instead, she was shot down in flames.  This was in large part a failure, the latest in a sorry saga of them, of British negotiating tactics. In advance of the summit, Mrs May had sent cabinet ministers around European capitals in an effort to find allies. What London conceived of as a “charm offensive” was seen on the continent as an insulting attempt to drive wedges into the EU by trying to set member states against each other and against the commission’s negotiators. The belief that Britain can divide and conquer in the EU has been a persistent miscalculation on the part of its government. The effect has been to draw the EU closer together.  Things turned even more sour once the summit got under way in Salzburg. The hills were alive with the sound of other leaders becoming more and more irritated with the prime minister. Some were aggravated by Britain’s failure to produce fresh proposals to resolve the Irish border conundrum. Mrs May, whose emotional intelligence has never been terribly refined, did not help herself at the summit dinner by addressing them as if they were junior members of her cabinet rather than equals whose help she can’t do without. She presented her Chequers plan in a take-it-or-leave-it fashion that many in her audience found too aggressive. There was some incredulity around the table when she even started to read out bits of a newspaper article. Very well, they retorted, we will leave it. Donald Tusk , the European council president, said it clearly: the Chequers plan for selective participation in the single market “will not work” because it would undermine the integrity of the EU. This was not a new position. EU officials have been telling the British at all levels of engagement that Mrs May’s notion of a “common rulebook” for trade in goods is not viable and for a multiplicity of reasons. The EU has been saying this, just a bit more diplomatically than at Salzburg, for weeks. The only difference made by Mr Tusk was to spell it out in blunt language.  This exposed another persistent fantasy of the British government: that the EU does not really mean it when it says its “four freedoms” are non-negotiable. The EU has always been consistent in saying that it can’t compromise on this and for good reason. The single market (a British invention, incidentally) will start to unravel if members are allowed to cherrypick bits they like and leave aside those that don’t suit them so well. Even more would this be the case if a non-member, which is what Britain will be, was allowed to opt in and out as it pleased. Hence Mr Tusk’s Twitter joke about Mrs May being offered a cake with “no cherries”. The EU’s own internal fractures, not least on immigration, make it even less willing to countenance special privileges for Britain. Anxiety about its own cohesion, particularly felt by Emmanuel Macron, further militates against conceding anything that might look like a reward for leaving.  All of this has been clear since Britain embarked down this peril-strewn path. None of this should have been as large a shock as it was to Mrs May.",9,2018-09-23 23:47:46
172,1097, The part of Brexit everyone’s been avoiding is finally here: immigration | Gaby Hinsliff,3,2018-09-23 23:47:54
173,1098,"W ho believes in the magic of self-organising, dynamic markets that never make mistakes? The crisis in British conservatism is that it is simultaneously a believer and non-believer. Just as it wants to be both out of Europe but in it, on its own terms, because that means prosperity and influence, so it proclaims undying fealty to markets while being forced to curb and intervene in them in practice. It turns the party into a political pantomime horse unfit to govern – and may ultimately force its break-up as the strains of the lived inconsistencies become intolerable.  For the dramas of Salzburg betray much deeper and profound intellectual conflicts. Theresa May’s ferociously anti-Europe wing of MPs is animated by a passionate belief in the precepts of US free-market libertarianism and sees Europe as the major intellectual and political obstacle. Last week, a group of British and US rightwing thinktanks published a blueprint for a post-Brexit US-UK trade deal.  Britain’s environmental and food standards regulation would be scrapped while our public sector would be opened up to be run by US companies, particularly in the NHS. The immigration system would be redrawn to favour free movement between the US and UK, to promote what they described as a new, free-market gold standard for trade deals. The state would be removed from the economy in an Anglo-American free market condominium, with the UK “regaining control” by becoming the 51st state but without any votes.  The British thinktanks, including the Initiative for Free Trade, whose president is the Eurosceptic Tory MEP Daniel Hannan, are outriders for the Tory Eurosceptic rightwing. The trade secretary, Liam Fox, is a keen advocate of such a deal, but he knows that to advocate scrapping food standards before Brexit would be political death. His colleague and fellow libertarian, the environment secretary, Michael Gove, has ruled it out for just that reason.  For markets, even though neither Gove nor Fox wants openly to concede it, don’t work as the ideology predicts. Market economies need the state, European-style. Privatising the NHS via a US trade deal while allowing the free import of genetically modified US food would create a political backlash to make last May’s reaction to new rail timetables look tame.  On Thursday, hours before Mrs May’s confrontation with reality in Salzburg, the Office of Rail and Road published its assessment of how the railways, organised to simulate a market, were unable to co-ordinate the movement of trains. The result was hundreds of cancellations, huge delays and disruption for millions. Nobody, observed the report, in this botched, unco-ordinated market was in charge.  In response, Eurosceptic, market ideologist and transport secretary, Chris Grayling, had to announce a full-scale review of the rail system. He wanted the review to be minimalist, confining itself to potential tweaks to the franchise system, but he was forced to concede that its terms of reference should include extending public ownership. The rail market needs to have a central organising authority. Otherwise, the self-interest of different actors, supposedly a key driver of market efficiency, means the system collapses into mayhem. The truth is that there is a such an authority, even in the current degraded and dysfunctional system: it is the Department for Transport . Except that Grayling doesn’t want to exercise such public power, except when forced to. Strangely, he keeps being forced.  These truths should be no surprise. They are the cornerstone of Keynesian economics, so derided by the Eurosceptic right but whose virtues have been underscored by, first, the financial crisis and now successive problems in deregulated industries. Markets, including and especially financial markets, need central organising public authorities, otherwise they spin out of control. The policy challenge is not to abandon society to their working or to socialise them, but to harness their power for the common good. That means accepting a role for an activist state and making sure it has the agility, capacity and quality officials to deliver .  Importantly, the British public, at the receiving end of the experiment that has now lasted four decades, is beginning to side with a Keynesian and European world view. There are huge majorities emerging in favour of public ownership and against austerity – last week, for example, the National Centre for Social Research reported that only 4% of both Tory and Labour voters think that the government needs to implement further cuts. Meanwhile, support for more tax-and-spend policies is running at 60%, a figure that has doubled since 2010.  This is – or should be – Labour’s opportunity. The shadow chancellor, John McDonnell, has begun to win intriguing plaudits for some of his ideas (including from Jim O’Neill, the former Treasury minister). These range from new forms of employee participation to reshaping the financial system. But they do not yet sit in a consistent social democratic world view incorporating our relations with Europe and are, above all, compromised by siding with the Eurosceptic right over Brexit.  The choice before the country is brutal. It is between the world heralded by the Anglo-American rightwing thinktanks or European liberal social democracy. Imagining, as Jeremy Corbyn and his circle seem to, that the argument will go away post Brexit, or if there is no second “people’s vote”, is self-deluding moonshine.  Making the argument for, say, a national investment bank, is suddenly easy. Integrating it into an argument for Europe is much tougher, but it’s what the left must do to be consistent, tap the new mood and win any general election. Changing Britain and halting Brexit are two sides of the same coin.  • Will Hutton is an Observer columnist",9,2018-09-23 23:47:56
174,1099,"C at Power, whose real name is Chan Marshall, meets me in the lobby of her London hotel, and things do not go as expected. First, she is warm and inviting, when her smoky, melancholy records had led me to expect someone much more remote. And second, she is immediately in full swing with her impersonation of my English accent. “Life in the old dog yet, eh!” she says, after we decide to go to her room to avoid the noise and the smoking rules. “Good old Blighty!” she adds, as we get into the lift. I didn’t see this coming – not from a woman who grew up in the Deep South of the US, where she learned to sing about drunks and devils and depravity while dodging them, and has been dodging them ever since. I didn’t know she’d be funny.  “Aaaaand relax,” the 46-year-old says, sitting down on the rooftop balcony of her hotel room, after opening a bottle of red wine from the minibar and lighting cigarettes for us that she keeps in a leather pouch she bought in Mexico. As we talk, she tops up my glass but not her own, “I can get you drunk, but not me,” she says, because she has to go on stage tonight. If you’re a fan of Cat Power’s music, you might be thinking: “Well, hang on a minute, she was drunk the last time I saw her live, in fact she turned her back on the audience, muttered something inaudible, stopped in the middle of three songs and then walked off.” Such erraticism is indeed something her live shows became known for; in her own life there were psychotic breakdowns, and she went to rehab for alcohol and prescription-drug addiction.  Her diehard fans never wavered, though. For them, to know Cat Power’s heartbreaking, raw music is to love her unconditionally, giving her a rightfully elevated position in the American alt-rock scene, alongside contemporaries such as Sonic Youth and Will Oldham . Her blues singing and otherworldly coolness have also been noted by the fashion industry, with Karl Lagerfeld asking her to model Chanel jewellery after seeing her smoking a cigarette outside the Mercer Hotel in New York.  Currently, she is on a wave of rebirth, having changed record label, surprised her fans by becoming a mother, and realised her mind was never what others thought it was. Her new album is called Wanderer , she produced it herself, and it has already attracted excitement with its first single, Woman, a duet recorded with Lana Del Rey . One music website explained that the astonishment at their pairing was because Del Rey gets called out for being too fake, while Marshall gets questioned for being too real. But we’re not here to focus on the things that women are criticised for – this is Cat Power’s female solidarity album. She even has a Rihanna cover version on it, which came about after she heard it in a car – and hated it.",3,2018-09-23 23:47:59
175,1100,"T here’s a kinship between director Steven Loveridge’s approach to his subject, the mercurial, confrontational British Tamil recording artist MIA, and her own magpie approach to music. Both cut and paste their sources and inspiration into a thrilling mash-up of noise and information. Loveridge has access to huge resources of self-filmed material, accounts of MIA’s quest for knowledge, about herself, her culture, her family. We see her travelling the world compiling the scrapbook of musical influences that makes her sound so vital. It is very much the MIA story told from the MIA viewpoint. Normally, this might be an issue, but, as the film points out, so many people have rushed to undermine and discredit her, it’s perhaps only fair that in this case she gets to tell her side, without spin or sly references to truffle fries .",9,2018-09-23 23:48:02
176,1101,"G randdaughter of Charlie Chaplin, Oona Chaplin was born in 1986 in Madrid, Spain. She graduated from Rada in 2007 and, after making her TV debut in Spooks (2007), went on to star in Game of Thrones (2012-13), Black Mirror  (2014) and Taboo (2017). She has also joined the cast of James Cameron’s forthcoming Avatar sequels. Her new film, Anchor and Hope , in which Chaplin and Natalia Tena star as a couple living on a houseboat in London, is in cinemas from Friday.  1. Video art  Vincent Moon",3,2018-09-23 23:48:09
177,1102, ,9,2018-09-23 23:48:11
178,1103, ,9,2018-09-23 23:48:14
179,1104,"A star of New York City Ballet and the co-founder of Dance Theatre of Harlem, Arthur Mitchell was also the first African American principal dancer in any major ballet company. Mitchell, who has died aged 84, had classical lines, buoyant energy and a palpable joy in movement.  In NYCB, where he danced from 1955 to 1968, he gained renown for two roles he created: the startlingly modernist Agon pas de deux , choreographed for him and Diana Adams by George Balanchine , and the mischievously bounding Puck in Balanchine’s A Midsummer Night’s Dream . According to his fellow NYCB dancer Jacques d’Amboise, “every time we toured Europe, he was a sensation … There would be hundreds of fans at the stage door.”  After Martin Luther King was assassinated in 1968, Mitchell had his own dream, which was to form a top-notch ballet company that would shatter the myth that black bodies were not “right” for ballet. In a garage lent by the Harlem School of the Arts and with the support of his mentor Karel Shook (artistic director of Dutch National Ballet), he started a school. They left the doors open to attract young people from the street. To keep them there, Mitchell compared ballet to basketball, hired drummers instead of pianists to accompany the class, and allowed the students to wear jeans. Within four months, Dance Theatre of Harlem school had 800 students , and the professional company debuted in 1971 at the Guggenheim Museum. It thrived for more than three decades, becoming one of the most sought-after dance companies in the world.",9,2018-09-23 23:48:22
180,1105,"A t a recent dressy school event, Edie, my 18-year-old daughter, wore a two-piece floral suit I’d bought in the days before children, when I didn’t think twice about dropping a couple of weeks’ wages on a single outfit. She made the look her own: wearing it knotted at the waist to reveal a taut inch of midriff and pairing it with trainers. It added an extra 100W to my proud, megawatt beam as her friends complimented her outfit. “It’s one of Mum’s,” she said, without a flicker of embarrassment. And if I hadn’t told you otherwise, you would have thought we’d coordinated our outfits, as I wore a lilac floral dress with a purple wicker handbag.",3,2018-09-23 23:48:25
181,1106, ,3,2018-09-23 23:48:28
182,1107,"A teenager has died after he was shot in east London , and a murder investigation has been launched.  The 19-year-old man was rushed to hospital by friends after the incident in Walthamstow at about 11pm on Saturday.  The victim was pronounced dead at 11.38pm, the Metropolitan police said.  Less than 24 hours earlier a 20-year-old man was killed in a stabbing at a house party in north-east London. Two others, a 17-year-old boy and a 24-year-old man, were also seriously injured in the incident, although their injuries were not life-threatening.  There have been more than 100 homicides in the capital so far this year.  Detectives were appealing for information over Saturday’s shooting.  Police said they were called to Vallentin Road shortly after 11pm.  “The victim – a 19-year-old man – was driven by friends to a north-east London hospital, where he was pronounced dead at 11.38pm,” the Met said. “Officers believe they know his identity, but await formal identification and confirmation that next of kin have been informed.  “A postmortem examination will be arranged in due course.”  No arrests have been made. Witnesses are urged to contact police.",3,2018-09-23 23:48:35
183,1108,"A group of leading Indian artists, in Britain to help commemorate the end of the first world war, says it has uncovered evidence of historic racism involving the care of soldiers traumatised by their experiences.  Combatants from the Indian subcontinent, along with many of those from what were then described as “lower social orders”, were not officially recognised as suffering from shell shock – a syndrome that is now covered by the term post-traumatic stress disorder, they say.  The artists, from Delhi and known as Raqs Media Collective , said that original documents uncovered in the British Library revealed that the armed forces systematically neglected to treat psychological problems among Indian soldiers.  Shuddhabrata Sengupta of Raqs, who are creating an artwork in Colchester commissioned by the arts body 14-18 Now for the Essex town’s Firstsite arts venue , said that British commanding officers appeared to use both class and race to ration mental health care during recuperation periods. “The condition of shell shock was first diagnosed in 1915 by the English doctor Charles Meyers,” said Sengupta. “But documents we found in the British Library show Meyers quickly dropped the term because it was feared ordinary soldiers would find it easy to understand and so would ask to be seen by medics.  “Instead Meyers suggested a more opaque diagnosis of NYD, or Not Yet Diagnosed – Nervous, which ordinary soldiers would find harder to use.”  The term “trench back”, which features in the art collective’s new piece Not Yet At Ease , was often adopted to describe symptoms that were actually psychological.  “The idea of ‘trench back’ derived from the earlier condition of ‘railway back’, which was used for people who were thought to have been upset, or jolted, by the speed of rail travel,” said Sengupta. “It was a way of talking about wounds or damage to the spine, instead of mental health. Trench back was supposedly caused by being knocked by falling debris in the trenches.”  In the summer of 1915, Captain John D Sandes, the officer in charge of electrotherapy at the temporary Kitchener Indian Hospital set up in Brighton, described his diagnosis of trench back in the British Medical Journal : “In a certain proportion a pronounced psychical factor can be traced, and these cases present features similar in many respects to the condition known as ‘railway spine’ and are always difficult to treat.”  Further reports written by the chief censor of Indian military correspondence in France, Evelyn Berkeley Howell, chronicle the increasing depression suffered by Indian soldiers: “Many of the men show a tendency to break into poetry which I am inclined to regard as a rather ominous sign of mental disquietude. The number of letters written by men who have obviously given way to despair has also increased both absolutely and relatively.”  Sengupta believes that the art installation in Colchester is the first public admission of these dubious wartime diagnoses outside scholarly circles. He and his fellow artists have created a twisting complex of padded cells to represent the treatment cells in the first world war hospitals. “But they also follow the form of the trenches themselves, which were labyrinthine. We are also creating a palimpsest of sounds, including readings from these official reports and fragments of a novel, with film footage and photos,” he said.",9,2018-09-23 23:48:38
184,1109,A star-studded voter registration drive launched by Michelle Obama will kick off its “National Week of Action” on Sunday with a rally in Las Vegas.,3,2018-09-23 23:48:41
